{
  "$schema": "../schemas/pack.schema.json",
  "name": "icons-solid-multi",
  "version": "1.0.0",
  "$type": "vector",
  "values": {
    "16": {
      "$rules": ["scale-16"]
    },
    "24": {
      "default": true
    }
  },
  "assets": {
    "sparkles": {
      "values": {
        "24": {
          "$file": "./packs/icons-solid-multi/Sparkles.svg"
        }
      },
      "platforms": ["PD"],
      "metadata": {
        "category": ["Multicolor"],
        "tags": [],
        "legacyNames": [
          "ai-sparkles-tag--16",
          "ai-sparkles-color--16",
          "ai-sparkles-color--24",
          "ai-sparkles-color--32",
          "ai-sparkles-color--72",
          "ai-sparkles-tag-color--16"
        ]
      }
    }
  }
}
