{
  "$schema": "../schemas/pack.schema.json",
  "name": "icons-stroke-multi",
  "version": "1.0.0",
  "$type": "vector",
  "values": {
    "16": {
      "$rules": ["scale-16", "stroke-1-6"]
    },
    "24": {
      "default": true
    }
  },
  "assets": {
    "CircleCheckGreen": {
      "values": {
        "24": {
          "$file": "./packs/icons-stroke-multi/CircleCheckGreen.svg"
        }
      },
      "platforms": ["PD"],
      "metadata": {
        "category": ["Multicolor"],
        "tags": ["alert", "status", "notification", "success", "ok"],
        "legacyNames": [
          "check-circle--24",
          "check-circle--32",
          "ok-clr--16",
          "ok-tray--16",
          "success--16",
          "success--32",
          "synced-d--16",
          "success-mix--32"
        ]
      }
    },
    "CircleClockBlue": {
      "values": {
        "24": {
          "$file": "./packs/icons-stroke-multi/CircleClockBlue.svg"
        }
      },
      "platforms": ["PD"],
      "metadata": {
        "category": ["Multicolor"],
        "tags": [
          "alert",
          "status",
          "notification",
          "in progress",
          "pending",
          "time"
        ],
        "legacyNames": [
          "in-progress-d--16",
          "pending-mix--32",
          "progress-clr--16",
          "progress-mix--32",
          "progress-red-mix--32",
          "progress-tray--16",
          "time-clr--16",
          "time-hurry-clr--16",
          "time-hurry-tray--16",
          "time-no-more-clr--16",
          "time-no-more-tray--16",
          "time-tray--16",
          "trial-tray--32",
          "trial-tray-mix--32",
          "pending--32",
          "pending--16",
          "progress--32",
          "progress--16"
        ]
      }
    },
    "CircleInfoBlue": {
      "values": {
        "24": {
          "$file": "./packs/icons-stroke-multi/CircleInfoBlue.svg"
        }
      },
      "platforms": ["PD"],
      "metadata": {
        "category": ["Multicolor"],
        "tags": ["alert", "status", "notification", "info", "information"],
        "legacyNames": ["info--16", "info--32", "info-mix--32"]
      }
    },
    "CircleMinusGray": {
      "values": {
        "24": {
          "$file": "./packs/icons-stroke-multi/CircleMinusGray.svg"
        }
      },
      "platforms": ["PD"],
      "metadata": {
        "category": ["Multicolor"],
        "tags": ["alert", "status", "notification", "unknown", "not available"],
        "legacyNames": ["unknown--16", "unknown--32"]
      }
    },
    "CircleTimesRed": {
      "values": {
        "24": {
          "$file": "./packs/icons-stroke-multi/CircleTimesRed.svg"
        }
      },
      "platforms": ["PD"],
      "metadata": {
        "category": ["Multicolor"],
        "tags": ["alert", "status", "notification", "danger", "error"],
        "legacyNames": [
          "danger--16",
          "danger--32",
          "danger-mix--32",
          "error-clr--16",
          "error-d--16",
          "error-tray--16",
          "forbidden--16",
          "forbidden--32"
        ]
      }
    },
    "CircleWarningOrange": {
      "values": {
        "24": {
          "$file": "./packs/icons-stroke-multi/CircleWarningOrange.svg"
        }
      },
      "platforms": ["PD"],
      "metadata": {
        "category": ["Multicolor"],
        "tags": ["alert", "status", "notification", "critical"],
        "legacyNames": [
          "alert-clr--16",
          "alert-tray--16",
          "state-alert-d--16",
          "critical--16",
          "critical--32",
          "critical-mix--32",
          "warning-circle--16",
          "warning-circle--32",
          "warning-circle-mix--32"
        ]
      }
    },
    "CirclesMulti": {
      "values": {
        "24": {
          "$file": "./packs/icons-stroke-multi/CirclesMulti.svg"
        }
      },
      "platforms": ["PD"],
      "metadata": {
        "category": ["Multicolor"],
        "tags": ["alert", "status", "notification", "multiple"],
        "legacyNames": ["multiple-mix--32", "multiple--16"]
      }
    },
    "DiamondWarningRed": {
      "values": {
        "24": {
          "$file": "./packs/icons-stroke-multi/DiamondWarningRed.svg"
        }
      },
      "platforms": ["PD"],
      "metadata": {
        "category": ["Multicolor"],
        "tags": ["alert", "status", "notification", "emergency"],
        "legacyNames": ["emergency--16", "emergency--32"]
      }
    },
    "DotBlue": {
      "values": {
        "24": {
          "$file": "./packs/icons-stroke-multi/DotBlue.svg"
        }
      },
      "platforms": ["PD"],
      "metadata": {
        "category": ["Multicolor"],
        "tags": ["alert", "status", "notification", "info", "information"],
        "legacyNames": [
          "dot-chart-info--16",
          "dot-info--16",
          "dot-success--16",
          "dot-chart-blue--16"
        ]
      }
    },
    "DotGray": {
      "values": {
        "24": {
          "$file": "./packs/icons-stroke-multi/DotGray.svg"
        }
      },
      "platforms": ["PD"],
      "metadata": {
        "category": ["Multicolor"],
        "tags": [
          "alert",
          "status",
          "notification",
          "neutral",
          "idle",
          "unknown"
        ],
        "legacyNames": ["dot-unknown--16", "dot-chart-grey--16"]
      }
    },
    "DotGreen": {
      "values": {
        "24": {
          "$file": "./packs/icons-stroke-multi/DotGreen.svg"
        }
      },
      "platforms": ["PD"],
      "metadata": {
        "category": ["Multicolor"],
        "tags": ["alert", "status", "notification", "success", "ok"],
        "legacyNames": ["dot-chart-success--16"]
      }
    },
    "DotOrange": {
      "values": {
        "24": {
          "$file": "./packs/icons-stroke-multi/DotOrange.svg"
        }
      },
      "platforms": ["PD"],
      "metadata": {
        "category": ["Multicolor"],
        "tags": ["alert", "status", "notification", "critical"],
        "legacyNames": ["dot-chart-critical--16", "dot-critical--16"]
      }
    },
    "DotRed": {
      "values": {
        "24": {
          "$file": "./packs/icons-stroke-multi/DotRed.svg"
        }
      },
      "platforms": ["PD"],
      "metadata": {
        "category": ["Multicolor"],
        "tags": [
          "alert",
          "status",
          "notification",
          "danger",
          "error",
          "emergency"
        ],
        "legacyNames": ["dot-chart-danger--16", "dot-danger--16"]
      }
    },
    "DotYellow": {
      "values": {
        "24": {
          "$file": "./packs/icons-stroke-multi/DotYellow.svg"
        }
      },
      "platforms": ["PD"],
      "metadata": {
        "category": ["Multicolor"],
        "tags": ["alert", "status", "notification", "warning"],
        "legacyNames": ["dot-chart-warning--16", "dot-warning--16"]
      }
    },
    "TriangleWarningYellow": {
      "values": {
        "24": {
          "$file": "./packs/icons-stroke-multi/TriangleWarningYellow.svg"
        }
      },
      "platforms": ["PD"],
      "metadata": {
        "category": ["Multicolor"],
        "tags": ["alert", "status", "notification", "warning"],
        "legacyNames": [
          "exclamation-triangle--16",
          "exclamation-triangle--24",
          "alert-triangle-clr--16",
          "warning--16",
          "warning--32",
          "warning-mix--32"
        ]
      }
    }
  }
}
